{"$defs":{"artifact_type":{"enum":["model_weights","model_config","tokenizer","generation_config","chat_template","prompt_formatter","serving_stack","container_image","cuda_lib","kernel_library","network_stack_binary","pmd_driver","runtime_knob_set","request_set","batching_policy","nic_link_config","collective_stack","compiled_extension","remote_code"],"type":"string"}},"$schema":"https://json-schema.org/draft/2020-12/schema","additionalProperties":false,"allOf":[{"properties":{"artifacts":{"contains":{"properties":{"artifact_type":{"const":"model_weights"}},"required":["artifact_type"],"type":"object"}}}}],"properties":{"artifacts":{"items":{"additionalProperties":false,"properties":{"artifact_id":{"pattern":"^[A-Za-z0-9._:-]+$","type":"string"},"artifact_type":{"$ref":"#/$defs/artifact_type"},"build_output":{"type":"boolean"},"digest":{"pattern":"^sha256:[a-f0-9]{64}$","type":"string"},"hash_algorithm":{"const":"sha256","type":"string"},"immutable_ref":{"minLength":1,"type":"string"},"name":{"minLength":1,"type":"string"},"resolved_from":{"type":"string"},"size_bytes":{"minimum":1,"type":"integer"},"source_kind":{"enum":["hf","oci","s3","http","git","nix","inline"],"type":"string"},"uri":{"minLength":1,"type":"string"}},"required":["artifact_id","artifact_type","name","source_kind","uri","immutable_ref","digest","size_bytes","hash_algorithm"],"type":"object"},"minItems":4,"type":"array"},"attestations":{"items":{"additionalProperties":false,"properties":{"attestation_type":{"enum":["resolver_provenance","build_provenance","signature"],"type":"string"},"signature":{"type":"string"},"signer":{"minLength":1,"type":"string"},"statement_digest":{"pattern":"^sha256:[a-f0-9]{64}$","type":"string"},"timestamp":{"format":"date-time","type":"string"}},"required":["attestation_type","signer","statement_digest","timestamp"],"type":"object"},"minItems":1,"type":"array"},"build":{"additionalProperties":false,"properties":{"builder_system":{"enum":["nix","equivalent"],"type":"string"},"closure_inputs_digest":{"pattern":"^sha256:[a-f0-9]{64}$","type":"string"},"closure_uri":{"pattern":"^(nix|equivalent)://closure/[a-f0-9]{64}$","type":"string"},"collective_stack_artifacts":{"items":{"additionalProperties":false,"properties":{"artifact_id":{"pattern":"^[A-Za-z0-9._:-]+$","type":"string"},"digest":{"pattern":"^sha256:[a-f0-9]{64}$","type":"string"},"immutable_ref":{"minLength":1,"type":"string"},"uri":{"minLength":1,"type":"string"}},"required":["artifact_id","digest","immutable_ref","uri"],"type":"object"},"type":"array"},"components":{"items":{"additionalProperties":false,"properties":{"artifact_count":{"minimum":1,"type":"integer"},"artifact_digest":{"pattern":"^sha256:[a-f0-9]{64}$","type":"string"},"artifact_ids":{"items":{"pattern":"^[A-Za-z0-9._:-]+$","type":"string"},"minItems":1,"type":"array","uniqueItems":true},"artifact_types":{"items":{"$ref":"#/$defs/artifact_type"},"minItems":1,"type":"array","uniqueItems":true},"name":{"enum":["serving_stack","cuda_userspace_or_container","kernel_libraries","network_stack","pmd_driver"],"type":"string"}},"required":["name","artifact_types","artifact_ids","artifact_count","artifact_digest"],"type":"object"},"minItems":3,"type":"array"},"nix_closure":{"additionalProperties":false,"properties":{"closure_digest":{"pattern":"^sha256:[a-f0-9]{64}$","type":"string"},"closure_size_bytes":{"minimum":1,"type":"integer"},"derivation_paths":{"items":{"minLength":1,"type":"string"},"type":"array"},"source":{"enum":["nix_cli","reference_descriptor","equivalent_descriptor"],"type":"string"},"store_paths":{"items":{"minLength":1,"type":"string"},"minItems":1,"type":"array"}},"required":["source","store_paths","derivation_paths","closure_size_bytes","closure_digest"],"type":"object"},"oci_artifacts":{"items":{"additionalProperties":false,"properties":{"artifact_id":{"pattern":"^[A-Za-z0-9._:-]+$","type":"string"},"artifact_type":{"$ref":"#/$defs/artifact_type"},"digest":{"pattern":"^sha256:[a-f0-9]{64}$","type":"string"},"immutable_ref":{"pattern":"^sha256:[a-f0-9]{64}$","type":"string"},"uri":{"pattern":"^oci://.+$","type":"string"}},"required":["artifact_id","artifact_type","uri","digest","immutable_ref"],"type":"object"},"type":"array"},"oci_image":{"additionalProperties":false,"properties":{"image_digest":{"pattern":"^sha256:[a-f0-9]{64}$","type":"string"},"image_ref":{"pattern":"^oci://.+$","type":"string"},"source_artifact_id":{"pattern":"^[A-Za-z0-9._:-]+$","type":"string"}},"required":["image_ref","image_digest","source_artifact_id"],"type":"object"}},"required":["builder_system","closure_uri","closure_inputs_digest","components","oci_artifacts","oci_image","nix_closure","collective_stack_artifacts"],"type":"object"},"canonicalization":{"additionalProperties":false,"properties":{"lockfile_digest":{"pattern":"^sha256:[a-f0-9]{64}$","type":"string"},"method":{"const":"json_canonical_v1","type":"string"}},"required":["method","lockfile_digest"],"type":"object"},"generated_at":{"format":"date-time","type":"string"},"lockfile_version":{"const":"v1","type":"string"},"manifest_digest":{"pattern":"^sha256:[a-f0-9]{64}$","type":"string"},"resolver":{"additionalProperties":false,"properties":{"name":{"minLength":1,"type":"string"},"version":{"minLength":1,"type":"string"}},"required":["name","version"],"type":"object"},"runtime_closure_digest":{"pattern":"^sha256:[a-f0-9]{64}$","type":"string"}},"required":["lockfile_version","generated_at","manifest_digest","runtime_closure_digest","resolver","canonicalization","artifacts","attestations"],"title":"lockfile.v1","type":"object"}
