{"artifacts":[{"artifact_id":"compiled-ext","artifact_type":"compiled_extension","digest":"sha256:abababababababababababababababababababababababababababababababab","hash_algorithm":"sha256","immutable_ref":"sha256:aaaaaaaaaaaaaaaaaaaaaaaaaaaaaaaaaaaaaaaaaaaaaaaaaaaaaaaaaaaaaaaa","name":"xformers","size_bytes":700,"source_kind":"s3","uri":"s3://mirror/xformers.whl"},{"artifact_id":"cuda-lib","artifact_type":"cuda_lib","digest":"sha256:2222222222222222222222222222222222222222222222222222222222222222","hash_algorithm":"sha256","immutable_ref":"sha256:2222222222222222222222222222222222222222222222222222222222222222","name":"cuda-user-space","size_bytes":3000,"source_kind":"oci","uri":"oci://registry.example/cuda@sha256:2222222222222222222222222222222222222222222222222222222222222222"},{"artifact_id":"kernel-lib","artifact_type":"kernel_library","digest":"sha256:3333333333333333333333333333333333333333333333333333333333333333","hash_algorithm":"sha256","immutable_ref":"sha256:3333333333333333333333333333333333333333333333333333333333333333","name":"flash-attn","size_bytes":400,"source_kind":"s3","uri":"s3://mirror/flash-attn.whl"},{"artifact_id":"model-weights","artifact_type":"model_weights","digest":"sha256:aaaaaaaaaaaaaaaaaaaaaaaaaaaaaaaaaaaaaaaaaaaaaaaaaaaaaaaaaaaaaaaa","hash_algorithm":"sha256","immutable_ref":"aaaaaaaaaaaaaaaaaaaaaaaaaaaaaaaaaaaaaaaa","name":"weights","size_bytes":1000,"source_kind":"hf","uri":"hf://org/model/model-00001.safetensors"},{"artifact_id":"request-set","artifact_type":"request_set","digest":"sha256:7777777777777777777777777777777777777777777777777777777777777777","hash_algorithm":"sha256","immutable_ref":"v1","name":"requests","size_bytes":64,"source_kind":"inline","uri":"inline://requests"},{"artifact_id":"runtime-knobs","artifact_type":"runtime_knob_set","digest":"sha256:6666666666666666666666666666666666666666666666666666666666666666","hash_algorithm":"sha256","immutable_ref":"v1","name":"runtime-knobs","size_bytes":64,"source_kind":"inline","uri":"inline://runtime-knobs"},{"artifact_id":"serving-stack","artifact_type":"serving_stack","digest":"sha256:1111111111111111111111111111111111111111111111111111111111111111","hash_algorithm":"sha256","immutable_ref":"sha256:1111111111111111111111111111111111111111111111111111111111111111","name":"vllm-stack","size_bytes":2000,"source_kind":"oci","uri":"oci://registry.example/vllm@sha256:1111111111111111111111111111111111111111111111111111111111111111"}],"attestations":[{"attestation_type":"resolver_provenance","signer":"resolver@deterministic-serving-stack","statement_digest":"sha256:cccccccccccccccccccccccccccccccccccccccccccccccccccccccccccccccc","timestamp":"2026-03-05T00:00:00Z"}],"canonicalization":{"lockfile_digest":"sha256:f86136fefee65f86ab1d0749282a977a4d029f9b228ca53b2b1773a600ce2a17","method":"json_canonical_v1"},"generated_at":"2026-03-05T00:00:00Z","lockfile_version":"v1","manifest_digest":"sha256:aaaaaaaaaaaaaaaaaaaaaaaaaaaaaaaaaaaaaaaaaaaaaaaaaaaaaaaaaaaaaaaa","resolver":{"name":"deterministic-resolver","version":"0.1.0"},"runtime_closure_digest":"sha256:bbbbbbbbbbbbbbbbbbbbbbbbbbbbbbbbbbbbbbbbbbbbbbbbbbbbbbbbbbbbbbbb"}
